Agency,Number of Websites,Number of Websites With Page Title,Number of Websites With Page Description,Number of Websites with Government Banner,Percent of Websites With Page Title,Percent of Websites With Page Description,Percent of Websites with Government Banner
.gov Administration,3,3,1,1,100.0,33.33,33.33
Access Board,5,3,2,2,60.0,40.0,40.0
Adams Memorial Commission,1,1,1,0,100.0,100.0,0.0
Administrative Conference of the United States,3,3,0,0,100.0,0.0,0.0
Administrative Office of the United States Courts,95,90,12,8,94.74,12.63,8.42
Advisory Council on Historic Preservation,1,1,0,0,100.0,0.0,0.0
American Battle Monuments Commission,3,3,1,1,100.0,33.33,33.33
Appalachian Regional Commission,5,4,0,0,80.0,0.0,0.0
Appraisal Subcommittee of the Federal Financial Institutions Examination Council,2,2,0,0,100.0,0.0,0.0
Architect of the Capitol,4,4,2,0,100.0,50.0,0.0
Arctic Research Commission,1,1,0,1,100.0,0.0,100.0
Barry Goldwater Scholarship and Excellence in Education Foundation,2,2,1,0,100.0,50.0,0.0
Board of Governors of the Federal Reserve,44,40,4,1,90.91,9.09,2.27
Central Intelligence Agency,3,2,0,0,66.67,0.0,0.0
Chemical Safety and Hazard Investigation Board,1,1,1,0,100.0,100.0,0.0
Civil Rights Cold Case Records Review Board,1,1,1,1,100.0,100.0,100.0
Commodity Futures Trading Commission,10,8,0,0,80.0,0.0,0.0
Congressional Budget Office,2,2,0,0,100.0,0.0,0.0
Consumer Financial Protection Bureau,13,11,4,2,84.62,30.77,15.38
Consumer Product Safety Commission,11,11,5,1,100.0,45.45,9.09
Corporation for National and Community Service,21,15,0,3,71.43,0.0,14.29
Council of the Inspectors General on Integrity and Efficiency,10,9,0,6,90.0,0.0,60.0
Court Services and Offender Supervision Agency for the District of Columbia,2,2,1,1,100.0,50.0,50.0
Delta Regional Authority,1,1,0,0,100.0,0.0,0.0
Denali Commission,3,3,1,0,100.0,33.33,0.0
Department of Agriculture,331,275,57,74,83.08,17.22,22.36
Department of Commerce,935,830,207,96,88.77,22.14,10.27
Department of Defense,988,944,151,29,95.55,15.28,2.94
Department of Education,137,126,23,14,91.97,16.79,10.22
Department of Energy,2317,2078,404,144,89.68,17.44,6.21
Department of Health and Human Services,2675,2425,489,240,90.65,18.28,8.97
Department of Homeland Security,438,417,57,38,95.21,13.01,8.68
Department of Housing and Urban Development,69,64,2,1,92.75,2.9,1.45
Department of Justice,456,436,44,54,95.61,9.65,11.84
Department of Labor,269,259,96,18,96.28,35.69,6.69
Department of State,345,327,230,209,94.78,66.67,60.58
Department of Transportation,367,338,38,25,92.1,10.35,6.81
Department of Veterans Affairs,572,548,101,21,95.8,17.66,3.67
Department of the Interior,494,418,83,76,84.62,16.8,15.38
Department of the Treasury,317,300,61,38,94.64,19.24,11.99
Election Assistance Commission,4,4,0,2,100.0,0.0,50.0
Environmental Protection Agency,196,185,36,35,94.39,18.37,17.86
Equal Employment Opportunity Commission,19,19,1,2,100.0,5.26,10.53
Executive Office of the President,85,78,15,6,91.76,17.65,7.06
Export-Import Bank of the United States,14,12,1,1,85.71,7.14,7.14
Farm Credit Administration,4,3,3,2,75.0,75.0,50.0
Farm Credit System Insurance Corporation,1,1,1,0,100.0,100.0,0.0
Federal Communications Commission,49,43,5,2,87.76,10.2,4.08
Federal Deposit Insurance Corporation,96,62,1,2,64.58,1.04,2.08
Federal Election Commission,13,12,4,0,92.31,30.77,0.0
Federal Energy Regulatory Commission,20,19,1,0,95.0,5.0,0.0
Federal Housing Finance Agency,13,11,2,1,84.62,15.38,7.69
Federal Judicial Center,5,3,0,0,60.0,0.0,0.0
Federal Labor Relations Authority,4,1,0,0,25.0,0.0,0.0
Federal Maritime Commission,4,4,0,1,100.0,0.0,25.0
Federal Mediation and Conciliation Service,1,1,1,1,100.0,100.0,100.0
Federal Mine Safety and Health Review Commission,1,1,0,0,100.0,0.0,0.0
Federal Permitting Improvement Council,1,1,1,1,100.0,100.0,100.0
Federal Retirement Thrift Investment Board,11,8,1,2,72.73,9.09,18.18
Federal Trade Commission,36,19,6,5,52.78,16.67,13.89
General Services Administration,474,369,125,168,77.85,26.37,35.44
Government Accountability Office,12,8,0,0,66.67,0.0,0.0
Government Publishing Office,23,21,3,0,91.3,13.04,0.0
Gulf Coast Ecosystem Restoration Council,2,1,1,1,50.0,50.0,50.0
Harry S Truman Scholarship Foundation,1,1,1,0,100.0,100.0,0.0
Institute of Museum and Library Services,6,6,3,0,100.0,50.0,0.0
Inter-American Foundation,2,2,0,1,100.0,0.0,50.0
International Trade Commission,9,8,2,4,88.89,22.22,44.44
James Madison Memorial Fellowship Foundation,1,1,0,0,100.0,0.0,0.0
Japan-United States Friendship Commission,3,3,0,0,100.0,0.0,0.0
Legal Services Corporation,5,5,2,0,100.0,40.0,0.0
Library of Congress,40,40,21,1,100.0,52.5,2.5
Marine Mammal Commission,1,1,1,0,100.0,100.0,0.0
Medicaid and CHIP Payment and Access Commission,1,1,0,0,100.0,0.0,0.0
Medicare Payment Advisory Commission,2,1,0,0,50.0,0.0,0.0
Merit Systems Protection Board,4,4,1,1,100.0,25.0,25.0
Millennium Challenge Corporation,7,6,1,1,85.71,14.29,14.29
Morris K. Udall and Stewart L. Udall Foundation,8,7,2,0,87.5,25.0,0.0
National Aeronautics and Space Administration,1252,1149,372,14,91.77,29.71,1.12
National Archives and Records Administration,110,109,12,2,99.09,10.91,1.82
National Capital Planning Commission,9,9,2,0,100.0,22.22,0.0
National Council on Disability,2,2,1,1,100.0,50.0,50.0
National Credit Union Administration,26,24,9,0,92.31,34.62,0.0
National Endowment for the Arts,6,6,1,1,100.0,16.67,16.67
National Endowment for the Humanities,4,4,0,0,100.0,0.0,0.0
National Gallery of Art,13,12,1,0,92.31,7.69,0.0
National Labor Relations Board,2,2,0,1,100.0,0.0,50.0
National Mediation Board,4,4,1,0,100.0,25.0,0.0
"National Railroad Passenger Corporation, Office of Inspector General",1,1,0,0,100.0,0.0,0.0
National Science Foundation,35,32,14,7,91.43,40.0,20.0
National Transportation Safety Board,4,4,1,0,100.0,25.0,0.0
Northern Border Regional Commission,1,1,0,0,100.0,0.0,0.0
Nuclear Regulatory Commission,28,19,2,2,67.86,7.14,7.14
Occupational Safety and Health Review Commission,2,2,0,0,100.0,0.0,0.0
Office of Congressional Workplace Rights,1,1,0,0,100.0,0.0,0.0
Office of Government Ethics,6,5,0,2,83.33,0.0,33.33
Office of Personnel Management,520,519,36,22,99.81,6.92,4.23
Office of Special Counsel,4,4,1,1,100.0,25.0,25.0
Office of the Director of National Intelligence,50,15,0,0,30.0,0.0,0.0
Open World Leadership Center,1,1,0,0,100.0,0.0,0.0
Peace Corps,61,61,0,2,100.0,0.0,3.28
Pension Benefit Guaranty Corporation,7,7,0,1,100.0,0.0,14.29
Postal Regulatory Commission,1,1,0,0,100.0,0.0,0.0
Presidio Trust,3,2,2,0,66.67,66.67,0.0
Privacy and Civil Liberties Oversight Board,1,1,0,0,100.0,0.0,0.0
Public Buildings Reform Board,1,1,0,1,100.0,0.0,100.0
Railroad Retirement Board,2,2,0,0,100.0,0.0,0.0
Securities and Exchange Commission,15,13,1,2,86.67,6.67,13.33
Selective Service System,5,5,0,0,100.0,0.0,0.0
Small Business Administration,35,34,9,7,97.14,25.71,20.0
Smithsonian Institution,6,3,2,0,50.0,33.33,0.0
Social Security Administration,17,11,6,4,64.71,35.29,23.53
Social Security Advisory Board,1,1,0,0,100.0,0.0,0.0
Southeast Crescent Regional Commission,1,1,0,0,100.0,0.0,0.0
Southwest Border Regional Commission,1,1,1,0,100.0,100.0,0.0
State Justice Institute,1,1,0,0,100.0,0.0,0.0
Stennis Center for Public Service,1,1,1,0,100.0,100.0,0.0
Supreme Court of the United States,2,2,0,0,100.0,0.0,0.0
Surface Transportation Board,2,2,1,1,100.0,50.0,50.0
Tennessee Valley Authority,16,10,0,0,62.5,0.0,0.0
Trade And Development Agency,1,1,0,1,100.0,0.0,100.0
U.S. Commission for the Preservation of Americas Heritage Abroad,2,1,2,0,50.0,100.0,0.0
U.S. Commission of Fine Arts,1,1,0,0,100.0,0.0,0.0
U.S. Commission on Civil Rights,2,2,1,1,100.0,50.0,50.0
U.S. Commission on International Religious Freedom,1,1,0,0,100.0,0.0,0.0
U.S. Interagency Council on Homelessness,7,1,1,1,14.29,14.29,14.29
U.S. Nuclear Waste Technical Review Board,1,1,0,0,100.0,0.0,0.0
U.S. Semiquincentennial Commission,2,2,1,0,100.0,50.0,0.0
U.S.-China Economic and Security Review Commission,1,1,1,0,100.0,100.0,0.0
United States AbilityOne Commission,5,5,0,3,100.0,0.0,60.0
United States African Development Foundation,2,2,1,0,100.0,50.0,0.0
United States Agency for Global Media,12,11,4,0,91.67,33.33,0.0
United States House of Representatives,481,467,85,0,97.09,17.67,0.0
United States International Development Finance Corporation,2,2,1,1,100.0,50.0,50.0
United States Postal Service,47,39,0,0,82.98,0.0,0.0
United States Senate,144,143,16,0,99.31,11.11,0.0
United States Sentencing Commission,1,1,0,0,100.0,0.0,0.0
United States Tax Court,1,1,1,1,100.0,100.0,100.0
Total,15108,13747,2912,1424,90.99,19.27,9.43
