Agency,Number of Websites,Number of Websites With Page Title,Number of Websites With Page Description,Number of Websites with Government Banner,Percent of Websites With Page Title,Percent of Websites With Page Description,Percent of Websites with Government Banner
.gov Administration,3,3,1,1,100.0,33.33,33.33
AMTRAK,2,2,0,0,100.0,0.0,0.0
Adams Memorial Commission,1,1,1,0,100.0,100.0,0.0
Administrative Conference of the United States,3,3,0,0,100.0,0.0,0.0
Administrative Office of the U.S. Courts,98,90,12,9,91.84,12.24,9.18
Advisory Council on Historic Preservation,1,1,0,0,100.0,0.0,0.0
American Battle Monuments Commission,3,3,1,1,100.0,33.33,33.33
Appalachian Regional Commission,5,4,0,0,80.0,0.0,0.0
Appraisal Subcommittee of the Federal Financial Institutions Examination Council,2,2,0,0,100.0,0.0,0.0
Architect of the Capitol,4,4,2,0,100.0,50.0,0.0
Barry Goldwater Scholarship and Excellence in Education Foundation,1,1,1,0,100.0,100.0,0.0
Central Intelligence Agency,2,1,0,0,50.0,0.0,0.0
Civil Rights Cold Case Records Review Board,1,1,1,1,100.0,100.0,100.0
Commodity Futures Trading Commission,10,8,0,0,80.0,0.0,0.0
Congressional Budget Office,2,2,0,0,100.0,0.0,0.0
Consumer Financial Protection Bureau,14,12,3,2,85.71,21.43,14.29
Consumer Product Safety Commission,12,12,6,1,100.0,50.0,8.33
Corporation for National and Community Service,21,14,0,3,66.67,0.0,14.29
Council of the Inspectors General on Integrity and Efficiency,11,11,0,5,100.0,0.0,45.45
Court Services and Offender Supervision Agency,3,3,1,1,100.0,33.33,33.33
Defense Nuclear Facilities Safety Board,1,1,0,1,100.0,0.0,100.0
Delta Regional Authority,1,1,0,0,100.0,0.0,0.0
Denali Commission,3,3,1,0,100.0,33.33,0.0
Department of Commerce,942,837,202,100,88.85,21.44,10.62
Department of Defense,1012,957,448,25,94.57,44.27,2.47
Department of Education,141,130,28,14,92.2,19.86,9.93
Department of Energy,2210,1954,411,121,88.42,18.6,5.48
Department of Health and Human Services,2661,2417,530,288,90.83,19.92,10.82
Department of Homeland Security,441,424,63,40,96.15,14.29,9.07
Department of Housing and Urban Development,66,62,3,1,93.94,4.55,1.52
Department of Justice,445,426,47,57,95.73,10.56,12.81
Department of Labor,270,259,110,24,95.93,40.74,8.89
Department of State,348,326,228,202,93.68,65.52,58.05
Department of Transportation,362,333,49,34,91.99,13.54,9.39
Department of Veterans Affairs,470,430,105,22,91.49,22.34,4.68
Department of the Interior,560,405,90,78,72.32,16.07,13.93
Department of the Treasury,306,295,56,29,96.41,18.3,9.48
Director of National Intelligence,47,12,4,0,25.53,8.51,0.0
Election Assistance Commission,4,4,0,2,100.0,0.0,50.0
Environmental Protection Agency,206,192,36,39,93.2,17.48,18.93
Equal Employment Opportunity Commission,12,12,1,2,100.0,8.33,16.67
Executive Office of the President,77,71,11,5,92.21,14.29,6.49
Export-Import Bank of the United States,19,17,1,1,89.47,5.26,5.26
Farm Credit Administration,3,3,2,1,100.0,66.67,33.33
Federal Communications Commission,50,45,6,4,90.0,12.0,8.0
Federal Deposit Insurance Corporation,88,60,2,2,68.18,2.27,2.27
Federal Election Commission,11,10,3,0,90.91,27.27,0.0
Federal Energy Regulatory Commission,21,20,1,0,95.24,4.76,0.0
Federal Housing Finance Agency,14,12,3,1,85.71,21.43,7.14
Federal Labor Relations Authority,4,1,0,0,25.0,0.0,0.0
Federal Maritime Commission,4,4,0,1,100.0,0.0,25.0
Federal Mediation and Conciliation Service,2,2,1,1,100.0,50.0,50.0
Federal Mine Safety and Health Review Commission,1,1,0,0,100.0,0.0,0.0
Federal Permitting Improvement Steering Council,1,1,1,1,100.0,100.0,100.0
Federal Reserve Board of Governors,42,37,6,0,88.1,14.29,0.0
Federal Retirement Thrift Investment Board,10,8,2,4,80.0,20.0,40.0
Federal Trade Commission,32,28,14,12,87.5,43.75,37.5
General Services Administration,503,371,130,168,73.76,25.84,33.4
Government Accountability Office,12,8,2,0,66.67,16.67,0.0
Government Publishing Office,25,23,3,1,92.0,12.0,4.0
Gulf Coast Ecosystem Restoration Council,3,2,1,1,66.67,33.33,33.33
Harry S. Truman Scholarship Foundation,1,1,1,0,100.0,100.0,0.0
Institute of Museum and Library Services,7,7,3,1,100.0,42.86,14.29
Inter-American Foundation,2,2,1,2,100.0,50.0,100.0
James Madison Memorial Fellowship Foundation,1,1,0,0,100.0,0.0,0.0
Japan-U.S. Friendship Commission,3,3,0,0,100.0,0.0,0.0
Legal Services Corporation,5,5,2,0,100.0,40.0,0.0
Library of Congress,40,35,23,1,87.5,57.5,2.5
Marine Mammal Commission,1,1,1,0,100.0,100.0,0.0
Medicaid and CHIP Payment and Access Commission,1,1,0,0,100.0,0.0,0.0
Medicare Payment Advisory Commission,2,1,0,0,50.0,0.0,0.0
Merit Systems Protection Board,3,3,1,1,100.0,33.33,33.33
Millennium Challenge Corporation,9,8,1,1,88.89,11.11,11.11
Morris K. Udall and Stewart L. Udall Foundation,8,7,2,0,87.5,25.0,0.0
National Aeronautics and Space Administration,1306,1199,417,15,91.81,31.93,1.15
National Archives and Records Administration,106,105,16,2,99.06,15.09,1.89
National Capital Planning Commission,9,9,2,0,100.0,22.22,0.0
National Council on Disability,2,2,1,1,100.0,50.0,50.0
National Credit Union Administration,28,27,10,0,96.43,35.71,0.0
National Endowment for the Arts,5,5,1,0,100.0,20.0,0.0
National Endowment for the Humanities,4,4,0,0,100.0,0.0,0.0
National Gallery of Art,13,12,3,0,92.31,23.08,0.0
National Indian Gaming Commission,3,3,1,0,100.0,33.33,0.0
National Labor Relations Board,2,2,0,1,100.0,0.0,50.0
National Mediation Board,4,4,1,0,100.0,25.0,0.0
National Science Foundation,38,35,12,7,92.11,31.58,18.42
National Transportation Safety Board,5,5,1,0,100.0,20.0,0.0
Networking Information Technology Research and Development,1,1,0,1,100.0,0.0,100.0
Northern Border Regional Commission,1,1,0,0,100.0,0.0,0.0
Nuclear Regulatory Commission,31,22,3,2,70.97,9.68,6.45
Occupational Safety and Health Review Commission,2,2,0,0,100.0,0.0,0.0
Office of Congressional Workplace Rights,1,1,0,0,100.0,0.0,0.0
Office of Government Ethics,6,5,0,2,83.33,0.0,33.33
Office of Personnel Management,514,512,38,26,99.61,7.39,5.06
Open World Leadership Center,1,1,0,0,100.0,0.0,0.0
Peace Corps,62,62,0,1,100.0,0.0,1.61
Pension Benefit Guaranty Corporation,7,7,0,1,100.0,0.0,14.29
Postal Regulatory Commission,1,1,0,0,100.0,0.0,0.0
Presidio Trust,3,2,2,0,66.67,66.67,0.0
Privacy and Civil Liberties Oversight Board,1,1,0,0,100.0,0.0,0.0
Public Buildings Reform Board,1,1,0,1,100.0,0.0,100.0
Railroad Retirement Board,2,2,0,0,100.0,0.0,0.0
Securities and Exchange Commission,15,13,1,3,86.67,6.67,20.0
Selective Service System,5,5,0,0,100.0,0.0,0.0
Small Business Administration,39,38,10,7,97.44,25.64,17.95
Smithsonian Institution,5,1,1,0,20.0,20.0,0.0
Social Security Administration,17,11,6,5,64.71,35.29,29.41
Social Security Advisory Board,1,1,0,0,100.0,0.0,0.0
Southeast Crescent Regional Commission,1,1,0,0,100.0,0.0,0.0
Southwest Border Regional Commission,1,1,1,0,100.0,100.0,0.0
State Justice Institute,1,1,0,0,100.0,0.0,0.0
Stennis Center for Public Service,1,1,1,0,100.0,100.0,0.0
Supreme Court of the United States,2,2,0,0,100.0,0.0,0.0
Surface Transportation Board,2,2,1,1,100.0,50.0,50.0
Tennessee Valley Authority,18,15,0,1,83.33,0.0,5.56
U.S. Chemical Safety Board,1,1,1,0,100.0,100.0,0.0
U.S. Commission for the Preservation of Americas Heritage Abroad,2,1,2,0,50.0,100.0,0.0
U.S. Commission of Fine Arts,1,1,0,0,100.0,0.0,0.0
U.S. Commission on Civil Rights,2,2,1,1,100.0,50.0,50.0
U.S. Commission on International Religious Freedom,1,1,1,0,100.0,100.0,0.0
U.S. Department of Agriculture,367,315,68,87,85.83,18.53,23.71
U.S. Interagency Council on Homelessness,7,1,1,1,14.29,14.29,14.29
U.S. Nuclear Waste Technical Review Board,1,1,0,0,100.0,0.0,0.0
U.S. Office of Special Counsel,2,2,0,1,100.0,0.0,50.0
U.S. Semiquincentennial Commission,3,2,0,0,66.67,0.0,0.0
U.S. Trade and Development Agency,1,1,0,0,100.0,0.0,0.0
U.S.-China Economic and Security Review Commission,1,1,0,0,100.0,0.0,0.0
United States AbilityOne Commission,4,4,0,3,100.0,0.0,75.0
United States Access Board,5,4,2,2,80.0,40.0,40.0
United States African Development Foundation,2,2,0,0,100.0,0.0,0.0
United States Agency for Global Media,12,11,4,0,91.67,33.33,0.0
United States House of Representatives,491,476,83,0,96.95,16.9,0.0
United States Institute of Peace,1,0,0,0,0.0,0.0,0.0
United States International Development Finance Corporation,2,2,1,1,100.0,50.0,50.0
United States International Trade Commission,10,9,2,4,90.0,20.0,40.0
United States Postal Service,61,50,1,0,81.97,1.64,0.0
United States Senate,144,143,17,0,99.31,11.81,0.0
Western Hemisphere Drug Policy Commission,1,1,0,0,100.0,0.0,0.0
Total,15101,13613,3378,1489,90.15,22.37,9.86
